name,category,pid,price,image,description,rating,brand
"Indian Traditional Handicraft, For Decorative, 12""",Indian Handicrafts,0,390.0,//5.imimg.com/data5/SELLER/Default/2021/11/BQ/CO/YY/77706935/p9-500x500.png,Hand Weaven Sabai Grass Wall Plate,4.5,Sigmascott Private Limited
"Indian Traditional Handicraft Golden Grass Tray, For Decorative, 8""x2""",Indian Handicrafts,1,399.0,//5.imimg.com/data5/SELLER/Default/2021/12/VF/SK/GK/77706935/43w-500x500.png,"Durable and natural wicker material, environmentally friendly, and high-quality handwoven basket.",4.5,Sigmascott Private Limited
"Handmade Basket Weaving Indian Handicraft Supplier Golden Grass Mini Round Box, For Decorative, 3""X4""",Indian Handicrafts,2,149.0,//5.imimg.com/data5/SELLER/Default/2021/12/IO/DU/MJ/77706935/48w-500x500.png,"Durable and natural wicker material, environmentally friendly, and high-quality handwoven basket.",4.5,Sigmascott Private Limited
"Multicolor Wooden Elephant Statue Handmade Enamel Work Decorative Showpiece, 8*4*8",Indian Handicrafts,3,610.0,//5.imimg.com/data5/SELLER/Default/2020/10/QM/LK/KL/3800474/0x7a9129-500x500.jpg,"Wooden Elephant showpiece is one great decor nicely hand-painted with pretty eye catchy colors. The combination of multicolor with hand-painted cone work designs looks exquisite. This beautiful Elephant showpiece set is a result of skillful imagination of local artisans from India and it is entirely handcrafted with their efforts.            
Additional Information  Item Code  NHI0880   Delivery Time  2-3 days   Production Capacity  1000pcs   Packaging Details  Box packing",4.1,Nirmala Handicrafts
Indian Handicrafts,Indian Handicrafts,4,350.0,//5.imimg.com/data5/SELLER/Default/2021/3/RJ/LQ/QO/113882459/polyresin-gift-500x500.jpg,Baldhari Exports,4.5,Baldhari Exports
Metal Camel Statue Meenakari Painting Indian Crafts Jaipur Rajasthani Handicrafts,Indian Handicrafts,5,2000.0,//5.imimg.com/data5/YA/ML/ZI/SELLER-2656943/12inch-metal-camel-painting-500x500.jpg,Product Code  WEB CODE   MT 1022 12  We bring forth our vast industrial experience and expertise in this business  instrumental in providing 12Inch Metal Camel Painting,4.8,Shri Handicrafts
TWG Handicraft Mix Polyresin Decorative Ashirwad Buddha Statue,Buddha Statue,6,290.0,//5.imimg.com/data5/SELLER/Default/2021/4/SR/SM/MZ/1069982/polyresin-decorative-ashirwad-buddha-statue-500x500.jpeg,"We are India's Trusted Manufacturer of Innovative Variety of Polyresin sculpture/ statues. We Craft Our All Product from Fine Quality Material, these showpiecies reflects the artistic brilliance and adds elegance to your Inside home and Office decor.# Lord Buddha in Ashirwad Sitting Position Statue.#",3.7,TWG HANDICRAFT
"Madhubani Hand Painted Pure Tussar Silk Long Dupatta., Cream,white",Tussar Silk Dupatta,7,3000.0,//5.imimg.com/data5/SELLER/Default/2022/2/SX/VE/LN/34273507/img-20220206-wa0001-500x500.jpg,"Explore the collection of beautifully designed Madhubani hand painted pure tussar silk handloom vidarbha border long 2.5 mtrs dupatta width 36"", with silk mark tag. from Manisha Silk Weaves ,this piece is elegantly crafted which will surely add to your wardrobe. Pair this piece with heels or flats for a graceful look .",4.6,Manisha Silk  Weaves
Silk Embroidery Dupatta,Dupattas,8,280.0,//5.imimg.com/data5/XU/OY/AC/ANDROID-38167341/product-jpeg-500x500.jpg,"Pire cotton silk dupatta best quality golden zari.work            
Additional Information  Delivery Time  3days   Packaging Details  best quality dupatta and golden zari work with embrodry work and comfortable wear dupatta",4.6,N. M. Enterprises
Sami Gota Work Bandani silk duppta,Silk Dupatta,9,250.0,//5.imimg.com/data5/RU/EB/ZU/ANDROID-9025741/product-jpeg-500x500.jpg,Bandani gotta patti work duppta,5.0,Maviss Fashion
TWG Handicraft Multicolor Meditating Buddha Statue Sitting on Lotus,Buddha Statue,10,2100.0,//5.imimg.com/data5/SELLER/Default/2021/4/EV/MH/PD/1069982/buddha-decorative-statue-500x500.jpeg,"We are Best Known Manufacturer of Innovative Variety of Polyresin sculpture/ statues. We Craft Our All Product from Fine Quality Material, these showpiecies reflects the artistic brilliance and adds elegance to your home and Office decor.#This decorative Buddha Sitting on Lotus will be a peaceful addition to your garden or home.#",3.7,TWG HANDICRAFT
"Multicolor Multicolour Assorted Reversible Handmade Area Rug,Wool Jute Kilim Rug, Rectangle, Size/Dimension: 5 X 7 Feet",Handloom Carpets,11,120.0,//5.imimg.com/data5/SELLER/Default/2021/6/ZB/NU/PK/955035/wool-and-jute-dhurrie-handwoven-kilim-carpet-500x500.JPG,Wool and Jute Dhurrie Handwoven Kilim Carpet,4.3,"Vimla International, Jaipur"
"Rectangular Handloom Carpet, for Home & Offices",Handloom Carpets,12,80.0,//5.imimg.com/data5/DU/GJ/MH/SELLER-27294756/handloom-carpet-500x500-500x500.jpg,We are an accomplished organization which has gained name and fame in providing Handloom Carpet,3.7,Fab Export International
For Home Mixed Handloom Printed Carpets,Handloom Carpets,13,4000.0,//5.imimg.com/data5/SELLER/Default/2020/12/JC/VC/DL/4327510/handloom-printed-carpets-500x500.jpeg,"Handloom Carpet Printed in Abstract Design            
Additional Information  Delivery Time  28 days   Production Capacity  10000   Packaging Details  Pallet 
",4.7,Pihue Creations
"Cotton Handloom Fabric, Traditional, Multicolour",Cotton Handloom Fabrics,14,85.0,//5.imimg.com/data5/SELLER/Default/2021/10/PJ/CZ/IE/133437176/cotton-handloom-fabric-500x500.jpeg,"Traditional,Multicolour
Cotton printed fabric
Use for all type of Kurti, Plazo, Ladies kurties.",5.0,S. S. Textiles
"South Cotton Handloom Fabric, Check/stripes, Multicolour",Cotton Handloom Fabrics,15,82.0,//5.imimg.com/data5/SELLER/Default/2021/2/ZU/RH/UG/66853948/south-cotton-handloom-fabric-500x500.jpeg,"South cotton handloom fabricgsm-150		width-47	lenth 95uses- men shirts, ladies kurties, jents kurtas",4.9,Shri Ganesh Fabrics
"South cotton handloom fabric, Plain/Solids, Multicolour",Cotton Handloom Fabrics,16,85.0,//5.imimg.com/data5/ANDROID/Default/2021/4/RF/PO/FX/66853948/product-jpeg-500x500.jpg,"Any apparel, accessories, footwear, sunglasses, certain fashion Jewellery, etc. 
",4.9,Shri Ganesh Fabrics
"Khadi Banaswara handloom fabric cotton, For Garments",Handloom Fabrics,17,65.0,//5.imimg.com/data5/SELLER/Default/2021/9/WM/KE/MY/62639270/banaswara-500x500.jpeg,"Handloom Fabric  Width  44  amp  GSM  130            
Additional Information  Delivery Time  7   Production Capacity  10000 
",4.0,J. Bharat Khadi Bhandar
Wool Fabric woven Handloom Fabrics,Handloom Fabrics,18,320.0,//5.imimg.com/data5/SELLER/Default/2021/10/FE/KH/ZH/87748741/a-new-design-made-with-postermywall-1--500x500.jpg,Omdev Fashion,4.6,OMDEV FASHION
"Jacquard Geometric Fabrics, Multicolour",Geometric Fabric,19,165.0,//5.imimg.com/data5/SELLER/Default/2021/5/FS/AC/YU/84968492/coco-1-500x500.jpg,"Ready Made Curtain is easily adapted to fitany window, door & long door size and thewide range of available textiles allows you totailor the atmosphere in your home.Whether you want particular tones andnatural finishes or something bold andcolorful, we can design Ready Made Curtainto make it unique.The most common sizes on the Indianmarket are: 4x5 Feet, 4x7 Feet and 4x9Feet.minimum order 600 meter 
Additional Information  Delivery Time  40 day's from order 
",4.1,Ravi Exports Ltd.
Digital Print Crepe Geometrical Printed Fabric for Kids Garments,Geometric Fabric,20,93.0,//5.imimg.com/data5/SELLER/Default/2021/12/QA/MJ/JY/17641534/whatsapp-image-2021-12-08-at-11-21-33-1--500x500.jpeg,"Trendy and Fashionable Digital Printed fabrics with mix match design. Suitable for Garments and Western wear.            
",4.6,Sohini Silk Mill
Geometrical Cotton,Geometric Fabric,21,160.0,//5.imimg.com/data5/SELLER/Default/2021/4/GF/HE/SK/84968492/coco-2-500x500.jpg,"Ready Made Curtain is easily adapted to fitany window, door & long door size and thewide range of available textiles allows you totailor the atmosphere in your home.Whether you want particular tones andnatural finishes or something bold andcolorful, we can design Ready Made Curtainto make it unique.The most common sizes on the Indianmarket are: 4x5 Feet, 4x7 Feet and 4x9Feet.            
",4.1,Ravi Exports Ltd.
Chinnon Bandhani Bhandej Dupatta,Bhandej Dupatta,22,110.0,//5.imimg.com/data5/SELLER/Default/2022/1/WF/ZB/AW/132647943/bhandej-dupatta-500x500.jpeg,Chinnon Crush Bhandej Dupatta,5.0,Marudhara Fashion
Cotton Bandhani Rayon Dupatta Bandhej,Bhandej Dupatta,23,70.0,//5.imimg.com/data5/SELLER/Default/2021/3/CM/QX/ES/9887290/rayon-dupatta-bandhej-500x500.jpeg,"Rayon dupatta bandhej            
",4.4,Navkar Creation
Cotton Gota Patti Bandhej Dupatta,Bhandej Dupatta,24,1530.0,//5.imimg.com/data5/UB/VL/MY-5562519/bandhej-dupatta-500x500.jpg,"Bandhani Dupatta With Gottapatti Work Border            
",4.2,Kalasanskruti Retail Private Limited
Pure Bhandej and cibbory work Bandhej Chiffon Dupatta,Bhandej Dupatta,25,150.0,//5.imimg.com/data5/ANDROID/Default/2021/4/AD/GJ/HP/2520892/1618834984462-jpg-500x500.jpg,"Girls ciffon bhandej dupatta, cibbory dupatta, najnin print dupatta, bhandej dupatta            
",4.0,M.S. Designer
For Flooring Interior Designers Carpet,Designer Carpet,26,360.0,//5.imimg.com/data5/ANDROID/Default/2020/9/HI/FY/CS/4327510/product-jpeg-500x500.jpg,"Very soft and silky smooth carpet            
",4.7,Pihue Creations
"Plain Rectangular Polyester shaggy, for Home",Polyester Carpet,27,60.0,//5.imimg.com/data5/PL/VI/JE/ANDROID-1840220/1567527781503-jpg-500x500.jpg,"For the fulfillment of growing industry needs, we are presenting the superiority fabricated collection of Polyester Carpet.
Our Carpets are considered as the decorative item of the homes and offices and are admired for the fine stitching and attractive designs.
 
",3.8,JP2 Industries
"Silk Festive Wear Singal Akkat Patola Sarees, With Blouse Piece",Patola Sarees,28,9500.0,//5.imimg.com/data5/SELLER/Default/2021/2/MI/NK/CV/115639711/singal-akkat-patola-sarees-500x500.jpeg,"Singal akkat patola sarees            
",4.8,Hareshbhai Mulajibhai Parmar
650 ROWSILK PATOLA SAREE,Patola Sarees,29,895.0,//5.imimg.com/data5/HE/IQ/ID/SELLER-43239049/patola-saree-500x500.jpg,NEW RICH PATOLA SAREE WITH JARI VIVING BORDER AND BUTTIS EXCLUSIVE HEND PRINTING SAREES,4.2,Gaytri Family Shop
"Nivah Fashion Red,Green Box Panetar Patola Saree, 5.5, With Blouse Piece",Patola Sarees,30,2500.0,//5.imimg.com/data5/SELLER/Default/2021/10/OR/NB/XF/73084833/whatsapp-image-2021-08-23-at-12-16-53-pm-1--500x500.jpeg,Saree Fabric,4.3,Nivah Fashion
Knee Long Embroidered Saree And Kurta combo,Khadi Sarees,31,1000.0,//5.imimg.com/data5/RW/VB/NK/ANDROID-51875784/product-jpeg-500x500.jpg,"Khadi cotton applique work saree and kurta            
",3.7,Uttaran Shilpa Kutir
Festive Wear Multicolor row silk khadi cotton saree,Khadi Sarees,32,525.0,//5.imimg.com/data5/FL/YT/LP/SELLER-43239049/whatsapp-image-2020-03-12-at-2-55-11-pm-500x500.jpeg,Raw Silk Saree With Khadi Weaving Pallu,4.2,Gaytri Family Shop
"Party Wear Printed Women Khadi Cotton Silk Saree, 6.3 m (with blouse piece)",Khadi Silk Sarees,33,225.0,//5.imimg.com/data5/SELLER/Default/2020/9/PV/VZ/II/70773681/whatsapp-image-2020-09-11-at-4-02-00-pm-500x500.jpeg,Printed Khadi Silk Saree With Jhalor in Lowest Price With Best Qualtiy,3.8,M K Trading
"Golden Round Decorative glass pumpkin, For Decoration",Handicraft Items,34,450.0,//5.imimg.com/data5/ZP/YY/HM/ANDROID-46368975/prod-20200423-170901564061084688156210-jpg-500x500.jpg,"Glass Pumpkin These magical glass pumpkins make a statement all year round with their rich colors, fine details, and playfully coiled stems. Pair this hand blown glass            
",4.0,Alsa Glass Handicrafts
"Polished Embossed Dokra Painting Frame, Size: 8 X 10",Handicraft Items,35,1200.0,//5.imimg.com/data5/KO/PZ/UI/SELLER-292984/embossed-dokra-painting-frame-500x500.JPG,"Embossed Dokra Painting Frame offered by us is an ethnic brass craft originating in the eastern parts of India, which is produced by tribal craft society. We make use of handmade lost-wax techniques to produce dhokra brass metal crafts that can be availed in net and figure forms. In this range of brass metal crafts, we offer various gift forms to create photo frames, jewelry and figures, among others. 
",4.4,Pushpam Arts
Metal Handicraft Enamel Items for Decoration,Handicraft Items,36,149.0,//5.imimg.com/data5/HY/JE/QZ/SELLER-1012852/handicraft-enamel-items-500x500.jpg,"Metallic cheap good quality enamel items in all shapes and sizes. Prices mentioned are for a specific small size and vary. 
Additional Information  Item Code  BS-002A 
",3.8,Royal De Wajidsons
Glass Inkpots,Glass Handicrafts,37,185.0,//4.imimg.com/data4/IN/LD/MY-21085483/glass-inkpots-250x250.jpg,"Other Details:
Code: DC2200Max In Dia Cm: 7.5Height In Cm: 6MOQ In Pcs: 48Description: You can find a wide assortment of glass inkpots in multiple shapes and sizesThese are used as a luxury important business gift 
Additional Information  Item Code  Dc2200   Delivery Time  15-20 days   Port Of Dispatch  EX FACTORY   Production Capacity  1000   Packaging Details  Singal Pcs Export Packing   Payment Terms  T/T (Bank Transfer) 
",3.9,Dlite Crafts
Glass Crystal Duck Pair Showpiece,Glass Showpiece,38,599.0,//5.imimg.com/data5/SELLER/Default/2021/6/RI/JN/PJ/96341302/1-1--500x500.jpg,"Attraction With Stylish Design, Quality Of Best Material, Performance And Durability For Long Life In Reasonable Price, Indian Reason Unique Stuff With MAKE IN INDIA Spirituality From House Of ""Tailos""
 
",4.5,Shri Balaji Enterprises
Acrylic Multicolor Couple gift showpiece,Showpiece,39,90.0,//5.imimg.com/data5/RJ/XV/YA/SELLER-92748598/best-wishes-gift-item-500x500.jpg,"We are engaged in offering Best Wishes Gift Item, which is extremely praised in the market. Owing to high demand, professionals make these products in varied patterns.
 
",4.1,S.K.G. Enterprises
"Acrylic Taj Mahal LED Disco Light Decorative Showpiece, For Gift Purpose",Showpiece,40,48.0,//5.imimg.com/data5/CO/WU/FF/SELLER-92748598/best-wishes-gift-items-500x500.jpg,"Couple gift, table top gift, wedding gift, etc. 
 
",4.1,S.K.G. Enterprises
"Polyresin Dinine Craft Decorative Showpiece, For Decoration, Packaging Type: Box",Showpiece,41,50.0,//5.imimg.com/data5/SELLER/Default/2021/3/IP/TE/EB/8070144/dinine-craft-decorative-showpiece-500x500.PNG,"We, Shaifali Traders is one of the leading supplier of",4.1,Shaifali Traders
"Multicolor Human Big Bawla Set 4 Inch, For Decoration",Handicraft Items,42,1200.0,//5.imimg.com/data5/II/NJ/KU/SELLER-46722905/tpbh-bawlaset4inch-1-500x500.jpg,"bawla set of 6 ( 4 inch, 5 inch, 6 inch)            
",4.4,ADSUP Marketing Solutions LLP
"Cotton Multicolor Home Decoration Handcraft Item, Size/Dimension: 25-50 Mm (diameter)",Handicraft Items,43,150.0,//5.imimg.com/data5/UI/DT/NY/SELLER-33442967/new-product-17-07-2020-1594973714-6254--500x500.jpeg,"Price Range: Rs 150-250/ Unit            
",3.8,S.R.V.P. Impex
"Round White Decorative Artificial Flowers Ring, For Event Decorations",Handicraft Items,44,9500.0,https://5.imimg.com/data5/VF/KL/QH/SELLER-2161621/decorative-artificial-flowers-panel-500x500.jpg,"Decorative Flower Frame with beautiful Flowers in available in different sizes for Wedding and Event Decorations.            
",3.9,Valley Of Flowers (A Unit Of Shreya Overseas)
"Flower metal diya, Size: 2.25x2.5, For Decorative",Handicraft Items,45,35.0,//5.imimg.com/data5/YC/QQ/VH/SELLER-52149104/20190711-123938-500x500.jpg,"decorative diya            
Additional Information  Item Code  1900   Delivery Time  10 to 15 days   Production Capacity  10000   Packaging Details  box 
",3.3,S.M.S Traders
"Indoor Curved Marble Singhasan, For Home, Size: Customizable",Marble Handicrafts,46,36000.0,//5.imimg.com/data5/EU/AB/KX/SELLER-8163415/marble-singhasan-500x500-500x500.jpg,Pure White Marble Singhasan with carving and inlay work.,5.0,Jain Marble & Tiles
Marble Peacock Urli 2 Feet,Marble Urli,47,2000.0,//3.imimg.com/data3/NB/CI/MY-5357349/untitled-1-500x500.jpg,"Backed by extensive industry experience in offering qualitative end solutions, Peacock Urli offered is flawlessly crafted that adds to the decor of that place. Here, our expertise lies in also making it available in defined shapes and design options as desired by the customers. Helping in enhancing aesthetic sense of surroundings, 2 feet peacock urli is suitable for adding to the aesthetics of areas like malls, hotels and others. Further, its flawless finishing and stylish designs, finely polished outer surface and sleek, stylish finish also make these the preferred choice of customers.            
",3.4,Konzept Arts
Silver Brass Handicraft Gift,Brass Handicrafts,48,160.0,//5.imimg.com/data5/SELLER/Default/2021/12/SM/HR/OI/57332491/brass-handicraft-gift-500x500-500x500.jpg,"These Products are made of metal and polished with best quality item so it will remain same and it can be used for home and kitchen purpose.            
",5.0,Urban Crafts India
Antique Brass Box,Brass Handicrafts,49,900.0,//5.imimg.com/data5/EP/AU/MY-8482776/antique-brass-box-500x500.jpg,Our company has achieved widespread recognition for providing,4.5,The Oldman Arts International
Unique Vintage Brass Car for Home,Brass Crafts,50,1100.0,//5.imimg.com/data5/EV/NP/YS/SELLER-37335946/31091903-1757384861005208-5137439248667901952-n-500x500.jpg,Vintage Crafts,4.0,Vintage Crafts
"Golden As Shown In Picture Brass Traditional Surai, For Home Decoration",Brass Crafts,51,750.0,//2.imimg.com/data2/QU/CI/MY-/27-500x500.jpg,"We are listed amid the principal companies affianced in the realm of presenting to our clients a huge assortment of Brass Traditional Surai. Under the command of skilled employees, the offered surai are made-up using exceptional-quality raw material and are enormously valued for their error less finish and flexibility. More to this, our clients can purchase these products from us at low-priced costs.",5.0,Handicraft Home (india)
Wooden Elephant,Wooden Elephant,52,1200.0,//5.imimg.com/data5/VB/EK/FQ/SELLER-44961164/wooden-elephant-500x500.jpg,"Relying on our crew of knowledgeable designers, we are engaged in offering eye-catching range of Wooden Elephant 
",4.4,Satish Fine Arts
Brown Wood Elephant Shikaar Carvings/Wooden Elephant,Wooden Elephant,53,350.0,//5.imimg.com/data5/BI/PJ/MY-12118886/handmade-jali-work-wooden-elephant-500x500.jpg,"Colour / Material : Light Brown / Wood.Hand Crafted Wooden Carved Elephant with Trunk Up - Fine Carving Upper Trunk Elephant FiguringSize:3""/4""/5""/6"" 
",4.2,Popli Brass Shop
"Wooden Bawla Musician for Decoration, Size: 2.5 Inches",Wooden Handicraft,54,280.0,//5.imimg.com/data5/DH/QB/MY-8604051/wooden-bawala-musician-2-500x500.jpg,"This handcrafted Rajasthani six-piece musician set is made of fine termite proof light weight wood. Each piece is beautifully hand painted. This show piece is an ideal item for your home decor. The item being handmade, the fine design, pattern and color tone of the product may vary slightly from that shown in the image.The musicians hold different instruments like: Dholak, Sitar, Table, Manjhira, Sarangi, Shehnai etc. 
",4.0,Indian Culture Handicraft
"Wooden Monkey Set for Gift, Size: 3 Inch",Wooden Handicraft,55,250.0,//5.imimg.com/data5/UG/XT/RI/ANDROID-12729036/product-jpeg-500x500.jpg,"This handcarved Gandhi Monkey is a set of 3 monkeys of Mahatma Gandhi- Do not See Evil, Do not Talk Evil, Do not Hear Evil. The monkeys are beautifully carved out of fine light weight wood with small monkeys seen from the jali as trapped inside the outer bigger monkeys. The height of the artifact is approx 3.5 inch.            
",3.7,Hastkala Arts
Wooden Parrot Round Pavati Wp057,Wooden Handicraft,56,180.0,//4.imimg.com/data4/EX/YH/ANDROID-1819434/product-500x500.jpeg,"Hand painted carved green wooden parrot round pavatisize (in)rate (rs. )31804270537565558750 
Additional Information  Item Code  WP057   Delivery Time  3 Days   Port Of Dispatch  Jaipur   Production Capacity  1000   Payment Terms  T/T (Bank Transfer)/D/A 
",3.8,Little India
cotton leaf Floral Single Blanket 104," Blankets, Quilts & Dohars",57,1999.0,http://img6a.flixcart.com/image/blanket/k/8/y/chdr-104-cotton-leaf-solapur-chaddar-1100x1100-imaeedxedwd7mbfy.jpeg,"cotton leaf Floral Single Blanket 104 (1 Authentic Solapuri Chaddar)
                         Price: Rs. 599
				
			Give authentic look to your bedroom with this Authentic Designed, 100 % Cotton, Handloom Woven Rich Solapuri Chaddar. This will add up to fresh look and comfort of your bedroom.
Give authentic look to your bedroom with this Authentic Designed, 100 % Cotton, Handloom Woven Rich Solapuri Chaddar. This will add up to fresh look and comfort of your bedroom.",4.3,cotton leaf
Handloom Hut Polyester Pista (Green) Crush Solid Eyelet Window Curtain, Curtains,58,1599.0,http://img5a.flixcart.com/image/curtain/g/r/d/greencrush003-7-213-shiv-shankar-handloom-eyelet-crush-curtain-1100x1100-imaebnxgwp7meuh2.jpeg,Buy Handloom Hut Polyester Pista (Green) Crush Solid Eyelet Window Curtain at Rs. 1099 at Flipkart.com. Only Genuine Products. Free Shipping. Cash On Delivery!,4.9,Handloom Hut
Handloomhub Polyester Pink Floral Eyelet Door Curtain, Curtains,59,799.0,http://img6a.flixcart.com/image/curtain/2/6/m/sdeuas1747-150-jazz-eyelet-curt206-1100x1100-imaey8r4fg3zqcdw.jpeg,Buy Handloomhub Polyester Pink Floral Eyelet Door Curtain at Rs. 518 at Flipkart.com. Only Genuine Products. Free Shipping. Cash On Delivery!,3.0,Handloomhub
Handloomhub Polyester Light Blue Self Design Eyelet Door Curtain, Curtains,60,1499.0,http://img6a.flixcart.com/image/curtain/n/6/g/hh-0038-213-homesazz-eyelet-plain-with-lace-original-imaefxy6nsbmdt4b.jpeg,Buy Handloomhub Polyester Light Blue Self Design Eyelet Door Curtain at Rs. 973 at Flipkart.com. Only Genuine Products. Free Shipping. Cash On Delivery!,3.9,Handloomhub
Handloomhub Polyester Pink Self Design Eyelet Door Curtain, Curtains,61,1499.0,http://img5a.flixcart.com/image/curtain/k/t/c/hh-0043-213-homesazz-eyelet-plain-with-lace-original-imaefxy69yftvxzh.jpeg,Buy Handloomhub Polyester Pink Self Design Eyelet Door Curtain at Rs. 973 at Flipkart.com. Only Genuine Products. Free Shipping. Cash On Delivery!,2.9,Handloomhub
Handloomhub Polyester Maroon Self Design Eyelet Long Door Curtain, Curtains,62,1899.0,http://img6a.flixcart.com/image/curtain/a/z/e/hh-030-274-handloomhub-eyelet-plain-with-lace-original-imaefxy6ahaaucx8.jpeg,Buy Handloomhub Polyester Maroon Self Design Eyelet Long Door Curtain at Rs. 1299 at Flipkart.com. Only Genuine Products. Free Shipping. Cash On Delivery!,2.9,Handloomhub
Handloomhub Polyester Brown Self Design Eyelet Long Door Curtain, Curtains,63,1899.0,http://img6a.flixcart.com/image/curtain/g/q/b/hh-031-274-handloomhub-eyelet-plain-with-lace-original-imaefxy6gfjnzxhb.jpeg,Buy Handloomhub Polyester Brown Self Design Eyelet Long Door Curtain at Rs. 1199 at Flipkart.com. Only Genuine Products. Free Shipping. Cash On Delivery!,3.1,Handloomhub
Handloomhub Polyester Purple Plain Eyelet Door Curtain, Curtains,64,1499.0,http://img5a.flixcart.com/image/curtain/p/2/n/hh-0035-213-homesazz-eyelet-plain-with-lace-original-imae3z2gzy2g7bsz.jpeg,Buy Handloomhub Polyester Purple Plain Eyelet Door Curtain at Rs. 973 at Flipkart.com. Only Genuine Products. Free Shipping. Cash On Delivery!,3.8,Handloomhub
Handloomhub Polyester Baby Pink Self Design Eyelet Long Door Curtain, Curtains,65,1899.0,http://img5a.flixcart.com/image/curtain/r/2/z/hh-007-152-handloomhub-eyelet-plain-with-lace-original-imaefxy7bskgzgmy.jpeg,Buy Handloomhub Polyester Baby Pink Self Design Eyelet Long Door Curtain at Rs. 1199 at Flipkart.com. Only Genuine Products. Free Shipping. Cash On Delivery!,3.6,Handloomhub
Shiv Shankar Handloom Polyester Purple Floral Eyelet Long Door Curtain, Curtains,66,2999.0,http://img6a.flixcart.com/image/curtain/x/r/f/rosepurple004-9-274-shiv-shankar-handloom-eyelet-rose-panel-original-imaebhpn4kvxphch.jpeg,Buy Shiv Shankar Handloom Polyester Purple Floral Eyelet Long Door Curtain at Rs. 1299 at Flipkart.com. Only Genuine Products. Free Shipping. Cash On Delivery!,4.2,Shiv Shankar Handloom
Nagar Handloom Floral Double Quilts & Comforters Multicolor," Blankets, Quilts & Dohars",67,2199.0,http://img6a.flixcart.com/image/blanket/j/h/x/meb03-nagar-handloom-printed-cotton-double-bed-ac-comforters-1100x1100-imaee958tzgvmrvf.jpeg,Buy Nagar Handloom Floral Double Quilts & Comforters Multicolor at Rs. 1350 at Flipkart.com. Only Genuine Products. Free Shipping. Cash On Delivery!,4.0,Nagar Handloom
Nagar Handloom Floral Double Blanket Multi," Blankets, Quilts & Dohars",68,2350.0,http://img6a.flixcart.com/image/blanket/h/q/2/meb02-nagar-handloom-floral-mink-double-blanket-1100x1100-imaee94xvgtzggyy.jpeg,Buy Nagar Handloom Floral Double Blanket Multi at Rs. 1399 at Flipkart.com. Only Genuine Products. Free Shipping. Cash On Delivery!,3.8,Nagar Handloom
